{
  "examples": [
    {
      "notes": "Doctor dry-run.",
      "request": {}
    }
  ],
  "failure_modes": [
    {
      "code": "validation_error",
      "description": "Input failed contract validation.",
      "recovery": "Fix input fields and retry with contract-compliant arguments."
    }
  ],
  "id": "qlip.shapes",
  "inputs": [],
  "purpose": "Inspect available schema/tool shapes.",
  "strictness": {
    "mode": "strict",
    "unknown_keys": "No arguments expected."
  },
  "title": "QLIP Shapes",
  "tool_name": "qlip.shapes"
}
